<?xml version="1.0" encoding="UTF-8"?>
<?xml-stylesheet type="text/xsl" href="transform_2.xsl"?>
<CyclingTourDatabase
    xmlns:xsi="http://www.w3.org/2001/XMLSchema-instance"
    xsi:noNamespaceSchemaLocation="Tour-cycling.xsd">

    <!-- =========================
         CLIENTS 
         ========================== -->
    <Clients>
        <Client clientId="c1">
            <firstName>Anna</firstName>
            <lastName>Martin</lastName>
            <email>anna.martin@example.com</email>
            <phone>+33-600-000-001</phone>
            <countryOfResidence>France</countryOfResidence>
            <experienceLevel>REGULAR</experienceLevel>
        </Client>
    </Clients>
    
    <!-- =========================
         GUIDES
         ========================== -->
    <Guides>
        <Guide guideId="g1">
            <name>Lucas Dupont</name>
            <certification>UCI Level 2</certification>
            <phone>+33-600-000-010</phone>
            <email>lucas.dupont@example.com</email>
        </Guide>
    </Guides>
    
    <!-- =========================
         TOUR PACKAGES
         ========================== -->
    <TourPackages>
        <TourPackage tourId="t1">
            <title>Alpine Coast to Peaks</title>
            <description>From the Mediterranean coastline to the high Alps over two days.</description>
            <totalDurationDays>2</totalDurationDays>
            <difficulty>CHALLENGING</difficulty>
            <currency>EUR</currency>
            <luggageTransport>true</luggageTransport>
            <!-- Stages belonging to this tour: s1 and s2 -->
            <stageIds>s1 s2</stageIds>
        </TourPackage>
    </TourPackages>
    
    <!-- =========================
         TRIP GROUPS
         ========================== -->
    <TripGroups>
        <TripGroup tripGroupId="tg1">
            <tourId>t1</tourId>
            <leadGuideId>g1</leadGuideId>
            <maxParticipants>8</maxParticipants>
            <!-- currentParticipants references clients -->
            <currentParticipants>c1</currentParticipants>
        </TripGroup>
    </TripGroups>
    
    <!-- =========================
         STAGES
         ========================== -->
    <Stages>
        <Stage stageId="s1">
            <tourId>t1</tourId>
            <dayNumber>1</dayNumber>
            <title>Nice to Guillaumes</title>
            <description>Climb from the coast into the first foothills of the Alps.</description>
            <distanceKm>120.0</distanceKm>
            <!-- Activities & paths for this stage -->
            <activityIds>a1</activityIds>
            <cyclingPathIds>p1</cyclingPathIds>
            <startDestinationId>d1</startDestinationId>
            <endDestinationId>d3</endDestinationId>
        </Stage>
        <Stage stageId="s2">
            <tourId>t1</tourId>
            <dayNumber>2</dayNumber>
            <title>Guillaumes to Briançon</title>
            <description>High-mountain stage with several passes before descending to Briançon.</description>
            <distanceKm>140.0</distanceKm>
            <activityIds>a2</activityIds>
            <cyclingPathIds>p2</cyclingPathIds>
            <startDestinationId>d3</startDestinationId>
            <endDestinationId>d2</endDestinationId>
        </Stage>
    </Stages>
    
    <!-- =========================
         DESTINATIONS
         ========================== -->
    <Destinations>
        <Destination destinationId="d1">
            <name>Nice</name>
            <country>France</country>
            <region>Provence-Alpes-Côte d'Azur</region>
            <type>COASTAL</type>
            <latitude>43.7034</latitude>
            <longitude>7.2663</longitude>
        </Destination>
        <Destination destinationId="d2">
            <name>Briançon</name>
            <country>France</country>
            <region>Hautes-Alpes</region>
            <type>MOUNTAINOUS</type>
            <latitude>44.8960</latitude>
            <longitude>6.6427</longitude>
        </Destination>
        <Destination destinationId="d3">
            <name>Guillaumes</name>
            <country>France</country>
            <region>Alpes-Maritimes</region>
            <type>MOUNTAINOUS</type>
            <latitude>44.0920</latitude>
            <longitude>6.8615</longitude>
        </Destination>
    </Destinations>
    
    <!-- =========================
         ACTIVITIES
         ========================== -->
    <Activities>
        <Activity activityId="a1">
            <name>Wine Tasting</name>
            <type>Gastronomy</type>
            <durationHours>2.5</durationHours>
            <cost>45.00</cost>
        </Activity>
        <Activity activityId="a2">
            <name>Castle Visit</name>
            <type>Cultural</type>
            <durationHours>1.5</durationHours>
            <cost>20.00</cost>
        </Activity>
    </Activities>
    
    <!-- =========================
         CYCLING PATHS
         ========================== -->
    <CyclingPaths>
        <CyclingPath pathId="p1">
            <name>Nice - Guillaumes Scenic Route</name>
            <difficulty>MODERATE</difficulty>
            <distanceKm>120.0</distanceKm>
            <elevationGainM>1800.0</elevationGainM>
            <surfaceType>Asphalt</surfaceType>
            <fromDestinationId>d1</fromDestinationId>
            <toDestinationId>d3</toDestinationId>
        </CyclingPath>
        <CyclingPath pathId="p2">
            <name>Guillaumes - Briançon Alpine Route</name>
            <difficulty>CHALLENGING</difficulty>
            <distanceKm>140.0</distanceKm>
            <elevationGainM>2400.0</elevationGainM>
            <surfaceType>Asphalt</surfaceType>
            <fromDestinationId>d3</fromDestinationId>
            <toDestinationId>d2</toDestinationId>
        </CyclingPath>
    </CyclingPaths>
    
    <!-- =========================
         BIKES & RENTAL LISTINGS
         ========================== -->
    <Bikes>
        <Bike bikeId="bike1">
            <model>Canyon Endurace 7</model>
            <frameSize>M</frameSize>
            <type>TREKKING</type>
            <availability>true</availability>
            <rentalPricePerDay>45.00</rentalPricePerDay>
        </Bike>
        <Bike bikeId="bike2">
            <model>Specialized Turbo Creo</model>
            <frameSize>L</frameSize>
            <type>ELECTRIC</type>
            <availability>true</availability>
            <rentalPricePerDay>65.00</rentalPricePerDay>
        </Bike>
    </Bikes>
    
    <RentalBikeListings>
        <RentalBikeListing listingId="rbl1">
            <!-- Listing composed of two bikes -->
            <bikeIds>bike1 bike2</bikeIds>
        </RentalBikeListing>
    </RentalBikeListings>
    
    <!-- =========================
         MAINTENANCE LOGS
         ========================== -->
    <MaintenanceLogs>
        <MaintenanceLog logId="ml1">
            <bikeId>bike1</bikeId>
            <date>2025-06-01</date>
            <cost>80.00</cost>
            <description>Full service before summer season.</description>
        </MaintenanceLog>
        <MaintenanceLog logId="ml2">
            <bikeId>bike2</bikeId>
            <date>2025-06-05</date>
            <cost>60.00</cost>
            <description>Battery check and brake adjustment.</description>
        </MaintenanceLog>
    </MaintenanceLogs>
    
    <!-- =========================
         BOOKINGS
         ========================== -->
    <Bookings>
        <Booking bookingId="b1">
            <clientId>c1</clientId>
            <tripGroupId>tg1</tripGroupId>
            <rentalBikeListingId>rbl1</rentalBikeListingId>
            <bookingDate>2025-05-20</bookingDate>
            <status>CONFIRMED</status>
            <totalPrice>620.00</totalPrice>
        </Booking>
    </Bookings>
    
</CyclingTourDatabase>
